id,nomemodello,numeroserie,dataproduzione,reparto,fornitore,dataacquisto,cliente,repartoassistenza,dataultimamanutenzione,garanziascadenza,descrizioneproblema,componentedifettoso,tecnicoassistenza,note,tipoprodotto,peso,dimensioni,consumoenergetico,materialescocca,colore,interfaccia,risoluzioneschermo,sistemaoperativo,cpu,ram,memoriainterna,fotocameraprincipale,fotocamerafrontale,connettivita,bluetoothversione,sensori,certificazioni,manualeutente,dataultimoaggiornamento,versionesoftware,statoproduzione,quantitamagazzino,quantitavendute,prezzounitario,valuta
24,live023,SN023,2021-10-06,base,Short Inc,2022-02-13,Martinez Group,and,2022-12-31,2022-12-31,Under war community there would. Discover speech voice region. Able happy young much determine morning outside. Plan win accept argue catch.,explain,Vanessa Spence,Top total candidate little front local stage alone. Result the film though scientist order onto. Theory open PM successful may.,trouble,2.46,21x11x6,6.95,somebody,LightPink,lead,2560x1440,work,hand,2 GB,58 GB,63 MP,3 MP,activity,5.0,"Act third home ten key type go article. Everybody development enjoy guy east decade. Let finish hope cause my main.
Side such hold interesting just reason. Break behind my traditional.",Leave build difference quite floor land series. Learn be option air all better begin. Step ok imagine likely have significant but.,<memory at 0x0000016026876D40>,2022-05-07,2.0,Fuori produzione,85,43,408.66,EUR
21,land020,SN020,2021-03-03,social,Collins Ltd,2021-07-06,Vasquez-Jones,because,2021-09-05,2021-10-28,"Stuff owner last Mr seek international. Fine use fine safe side along. Husband building need result floor be.
Appear industry minute compare relationship try. Piece central city.",position,Tonya Clark,"Network war direction assume prove. Manage itself general reason concern song law. Form wife sign light.
Start large month late court cultural as. End young instead feel visit amount.",know,1.59,10x10x8,9.16,charge,Moccasin,indeed,2560x1440,course,sell,47 GB,431 GB,20 MP,19 MP,understand,4.2,"Even land technology. Capital agency local information family network. Full that play help meet.
Save understand technology trouble standard. Chair attention father.","Growth like require hundred recently. Live career audience deal. To peace other sign.
Science statement bed general. Hope drive current improve cause detail sing.",<memory at 0x0000016026877100>,2022-05-16,3.0,Fuori produzione,27,21,834.21,USD
28,store027,SN027,2020-10-21,wide,Daugherty and Sons,2022-11-24,Vasquez Inc,defense,2022-11-24,2022-12-17,"Reflect piece ago future. Painting method successful.
Dark across ever memory in. Rule model during movie. Very what boy outside soon why.
National expert support agreement wife. News station today.",member,Brenda Santana,"Fast fill free fact floor tell shake. Research effort board if address six west.
Bag prove on together this paper design. Skin important what. Each rock son same strong.",push,2.94,18x21x5,8.08,which,LawnGreen,ago,2560x1440,industry,claim,54 GB,166 GB,32 MP,12 MP,social,5.0,"Goal consider him what. Allow mind kind western anyone center.
Question citizen sing treatment build fine culture. Seat sing just concern recognize green song throughout.",Enough small trouble star become side. Set nor best actually save. Possible must food central. Final training research two occur leg.,<memory at 0x0000016026875CC0>,2021-02-09,3.0,In produzione,56,23,510.64,USD
15,another014,SN014,2020-07-28,make,Frank-Woods,2021-06-29,Fisher-Elliott,after,2021-12-18,2022-09-23,"Usually manage process party hard. Plant pattern begin himself your.
Believe nothing make admit course. Sister hair second artist base station generation.",account,Tony Cook,Because method oil store. Material understand instead own. Relationship career concern vote. Offer prevent several.,green,3.21,19x10x9,9.42,party,DarkGoldenRod,management,2560x1440,realize,central,7 GB,317 GB,59 MP,9 MP,star,4.2,Action role candidate finish administration fire. Remember south toward million fast Mrs health. Peace budget forward think edge.,Tax action night street political mind indicate. Left move appear performance charge represent. Approach expert read actually save wonder. Carry mean them not human.,<memory at 0x0000016026876C80>,2022-06-11,3.0,In produzione,57,21,326.10,USD
3,feel002,SN002,2020-07-16,effect,Leon-Castillo,2022-10-02,Delgado-Arnold,particularly,2022-11-01,2022-12-04,Sign talk common name director them her. Fact generation available carry finish soldier we only. Field sea own finally computer maintain town.,western,Ryan Mendoza,"Rate south who itself. Of cost kid figure lot significant however. Not within class party.
Evidence charge near. Specific account rather firm. Simply art class bill serve.",cost,2.67,29x29x3,5.06,for,Cornsilk,west,2560x1440,evidence,mother,43 GB,201 GB,46 MP,13 MP,computer,4.2,"Any this learn someone check lay image. Red shake simply five.
Little tonight animal would. Apply alone me strategy economic.","Personal science quality performance past Democrat professor. Hand feel building help.
Close human law fast stage person save. Surface country song tax foot democratic bad per.",<memory at 0x0000016026876440>,2020-10-15,3.0,In produzione,62,37,702.09,USD
49,west048,SN048,2020-04-10,reach,Hoover-Thomas,2021-02-15,Torres Ltd,half,2021-07-08,2021-07-23,Site cup so marriage partner laugh. Technology set perhaps follow artist pay. Send anything spend light around deep somebody.,participant,Gregory Jackson,"Oil force appear. That sister he year.
Recognize stage thing election close seek. Discover particular yard technology alone.",determine,1.61,28x27x5,1.04,example,Wheat,pretty,2560x1440,outside,government,63 GB,91 GB,30 MP,31 MP,eat,4.2,"Never mouth me control course action color mind. Debate difficult statement meeting. By street budget figure forget government.
Mission human watch listen firm. Can agent again simply.","People article political full. Cultural nor only good usually. Rock yard together of reflect hot.
Like staff discuss door whose who nor.",<memory at 0x0000016026876140>,2020-10-18,3.0,In produzione,18,2,226.41,EUR
29,theory028,SN028,2020-03-22,cultural,Jones-Hardy,2021-08-31,"Mathis, Lane and Robertson",score,2022-07-23,2022-09-29,Couple see other operation. Head once including him century eat. Help century work key pretty responsibility. Attorney report some letter.,card,Melissa Ford,"Choose several close near can shake. Front interview quite my sort and. Commercial the ten old institution. End travel parent money exactly hold.
Already year clear.",whether,0.12,7x9x7,2.37,city,MediumSpringGreen,check,2560x1440,each,office,59 GB,110 GB,43 MP,25 MP,not,4.0,"Offer trip risk worker. Minute medical catch push nation. Stage now time foot girl.
Expect long seem even every put. Of positive pull view loss.",Person consider crime system tonight. Off nothing major Republican seek teach. What pattern action up everybody concern save. Pass another cost.,<memory at 0x0000016026877940>,2021-03-25,1.0,Fuori produzione,48,47,503.89,USD
18,focus017,SN017,2019-12-29,official,Gordon-Smith,2022-09-10,Stephens-Preston,person,2022-11-29,2022-11-30,"Any ahead third thing social recognize. Big person economy.
Image woman two left positive. If message prepare politics scientist or.",kid,Richard Smith,"Rather best oil. Amount cover television.
Night mouth enough resource necessary. Candidate worry follow choose south pass tonight. Total heart public somebody range.",live,3.93,14x26x8,4.16,play,DeepPink,inside,2560x1440,popular,himself,14 GB,292 GB,30 MP,20 MP,series,4.2,"Reason party at way chair executive election. Collection whole man born.
Whose energy cup left provide decade always give. Tonight time opportunity consider place. Process save program per.",School sit bring reality perform cost. Study green see new firm charge less.,<memory at 0x0000016026875C00>,2021-03-14,3.0,Fuori produzione,59,16,526.98,USD
38,bank037,SN037,2019-02-24,party,"Barton, White and Morgan",2020-08-16,"Lowery, Taylor and Fitzgerald",action,2022-05-04,2022-12-27,Type any part wife sell. Activity out least after support story. Because cover every four agree sea try foot.,much,William James,"Significant in activity building recognize including. Land those theory even view help week.
Reach enter lot suddenly. Sure turn shoulder protect quickly soon. Buy mind this where less mission hand.",pretty,2.90,19x22x4,1.28,she,LightSteelBlue,at,2560x1440,artist,small,20 GB,224 GB,40 MP,4 MP,from,4.2,"Coach son PM first. Day hair seat station find partner.
Chair reason performance entire parent above recently. Church however national business both.","Believe also wide turn community this country. Sign response in fish.
Something certainly fear movie season care.",<memory at 0x0000016026875FC0>,2019-07-15,2.0,Fuori produzione,52,38,592.30,EUR
10,pick009,SN009,2018-07-13,those,Graham and Sons,2019-12-10,Palmer-Montoya,wind,2020-02-28,2022-09-06,Note movement hospital white. Whatever dark name sign. House line inside daughter she team water.,receive,Cynthia Shah,Four reason eat put. Out huge yeah former be. Specific space toward store truth market industry.,begin,2.21,12x20x5,1.47,less,MediumSeaGreen,long,2560x1440,similar,pick,28 GB,92 GB,17 MP,26 MP,back,4.0,"Particular other foot Congress around. Water that worry seek challenge moment feel.
Might without father program leader. Official name identify world room memory.","Shake teach few.
Any even attack learn despite significant figure. Game main area focus then represent fact. Anything successful TV us.",<memory at 0x0000016026877280>,2021-12-20,3.0,Fuori produzione,10,9,389.32,EUR
19,but018,SN018,2018-02-10,herself,Campbell LLC,2019-07-29,"Crane, Brown and Murray",wait,2020-06-24,2021-11-04,Occur reason authority wonder decade build. Professor in he business skill create. Never office cover peace.,try,Patricia Perez,"Talk set push money. At wrong or real television process speech she.
Trade school happy example physical. Class firm far nor all. Still pressure others.
Seek media everything. Consumer final yes.",arm,1.95,26x25x6,5.86,financial,MediumOrchid,even,2560x1440,direction,hit,55 GB,147 GB,40 MP,28 MP,production,4.2,"Great health measure. Half range student a region. Smile citizen rock source.
Long whole forget real. Hear prepare decide again thousand tell.
Trade our adult her base teach be traditional.",World knowledge eye event hot book how into. Stop official show open story. Forward simple good never art imagine.,<memory at 0x0000016026875240>,2022-08-05,2.0,In produzione,56,22,829.09,EUR
9,size008,SN008,2018-01-09,thousand,Bean Ltd,2021-03-27,Aguirre LLC,out,2021-11-01,2022-12-17,"Name theory movie knowledge home. Sign itself help.
Agreement perhaps everybody positive arm. Prevent do matter attorney same top describe local. Expect store style international result vote.",break,Alicia Levy,Knowledge positive them investment actually describe. Voice must protect. Beyond six energy hundred should stuff work truth.,fish,4.12,9x8x1,8.37,friend,Teal,start,2560x1440,behind,door,45 GB,22 GB,40 MP,13 MP,create,5.0,"Bad beyond campaign newspaper. Watch leg research. Program travel foreign.
Future pretty goal effect case today family. Prevent catch day world together.","Pick per something behavior. Think movie fall case enough. Building despite deep.
Three minute assume. Your plan food staff enter.
Tv line research structure. Soon stage sure civil in entire trip.",<memory at 0x0000016026877880>,2018-07-26,1.0,Fuori produzione,37,6,996.88,USD
6,single005,SN005,2017-10-07,interest,"Reyes, Velazquez and Gregory",2021-06-30,"Roberson, Frost and Cook",security,2021-08-25,2022-07-12,Include age top site. Party range him type practice. Despite traditional political member occur skill someone issue.,discuss,Olivia Johnson,"Light save especially none cold. Republican table anyone mouth. Least notice friend brother human government audience she.
Military new need institution father.",onto,3.97,25x9x3,1.90,Congress,Wheat,natural,2560x1440,process,collection,3 GB,159 GB,24 MP,20 MP,culture,5.0,Water born themselves environmental clearly wait clearly. Present letter speech brother last. Consumer identify tax others.,"Leader attack theory. Less attack security as some apply.
Many whether realize. Similar would admit film partner month least. Relationship ok family.",<memory at 0x0000016026877A00>,2021-02-23,2.0,Fuori produzione,47,17,301.34,USD
46,against045,SN045,2017-03-15,still,Kennedy PLC,2022-05-14,"Benitez, Farrell and Bryant",eight,2022-11-02,2022-11-26,"Fact military or wife mission position make. Tonight we smile inside professor next.
Exist across western. Entire picture thousand protect occur usually. Good reveal leg head.",language,Amy Smith,"On usually surface recent science history. Unit technology home argue be dream nice keep.
Report offer letter race. Book them simply yes. Service environmental my level half radio.",sister,4.43,15x10x9,3.65,instead,SaddleBrown,main,2560x1440,perform,reach,45 GB,140 GB,38 MP,23 MP,son,4.2,"Still event first stage.
Local letter thing health worry. Week discover it think if. However yet heavy language body plant find.","Above serve truth possible. Although responsibility choose national.
Might attack evening machine use question. Across he finally college rest through discussion.",<memory at 0x0000016026875300>,2019-01-26,3.0,Fuori produzione,93,16,399.85,EUR
27,data026,SN026,2016-07-30,space,"Curtis, Anderson and Spencer",2016-10-17,Ortiz Inc,couple,2021-05-28,2021-06-27,"Safe resource answer sing rather billion.
Detail easy attention subject present over.
System go Republican set attention. Sister activity care pick party if big. Radio soldier enter general.",similar,Bailey Cox,Family environmental natural thousand. White population exist speech no call day. Thus design southern above training area.,computer,0.95,27x24x1,2.17,agency,Violet,help,2560x1440,cut,young,44 GB,474 GB,27 MP,26 MP,know,5.0,"Indicate tonight land player change they. The heart class form beyond four case.
Room political drug example customer necessary later support. So resource outside actually environmental you night.",Of could born today billion watch. Join Congress final TV prepare. Task senior true public person far.,<memory at 0x0000016026875480>,2018-06-25,1.0,Fuori produzione,67,3,338.40,USD
14,fight013,SN013,2016-06-28,million,White LLC,2018-12-18,"Thompson, Fletcher and Christensen",hot,2020-06-06,2022-07-29,"Mouth order bring stock. Yes care democratic reach customer toward public magazine. Know include power hand.
Hear water piece lose remember degree. Just above clearly. Company story increase.",have,Jessica Mullen,Trip together wide visit probably leave. Great between think time traditional director. Music near necessary light staff plant. Standard community employee camera against.,decade,4.14,23x11x9,7.67,stop,DarkTurquoise,question,2560x1440,explain,camera,47 GB,169 GB,64 MP,2 MP,which,4.0,"Stock under already then no and store occur. Husband bed activity clearly.
Republican baby young series daughter natural. Shake believe we at.",Born particular religious any thousand special near. Generation region suffer knowledge expect together wind. Make soon public weight visit quality table after.,<memory at 0x0000016026876F80>,2022-09-24,2.0,Fuori produzione,24,18,294.11,EUR
34,myself033,SN033,2016-04-20,what,Stephens-Washington,2021-10-22,Barnes-Anderson,size,2022-10-21,2022-11-29,"Pm until full.
House improve magazine increase audience. Tonight ok scene television.
Moment around blood bed heart. Opportunity evening pass sell like.",entire,Andrea Reynolds,"Direction visit fire sound. Politics interest pass degree. Other tough remember course garden budget exactly.
Idea western system career test sell. Military less structure good thought down.",put,4.22,8x10x7,3.43,two,SpringGreen,notice,2560x1440,black,sense,13 GB,431 GB,34 MP,2 MP,hot,5.0,"New political on its training. Others business not treatment.
Fly family personal want guy can accept. Teach window skin listen. Including cut PM character on address traditional level.","Local concern at. Involve both where teacher. Activity experience civil today become movie.
Measure describe care free. Dark both appear memory summer.",<memory at 0x0000016026877580>,2020-10-28,2.0,Fuori produzione,29,7,266.12,EUR
13,seek012,SN012,2016-03-23,culture,Smith-Williams,2017-01-30,"Welch, Pierce and Cortez",out,2019-02-23,2019-09-07,"Away spring name bag service. Whom authority exist area.
Store consider yeah war move type. Way argue loss stay a.
Arm it at management conference as behavior.",look,Steven Ortiz,"Single quality home during fight. Week beyond assume another idea be opportunity.
American have magazine partner pass surface training. Leave help resource specific.",network,0.93,14x10x7,5.29,company,Teal,heart,2560x1440,forget,walk,46 GB,433 GB,13 MP,29 MP,low,5.0,Power lose why reduce room hold policy. Attack prevent course require. Away husband method series camera lot situation pretty.,"Day man address claim company both every. Point federal really million song.
World near everybody seven nothing chance. Ten street opportunity leave.",<memory at 0x0000016026877400>,2018-03-13,3.0,In produzione,60,29,286.73,USD
41,to040,SN040,2015-11-19,will,"Johnston, Meadows and Ali",2022-09-24,Pham Inc,tend,2022-11-26,2022-12-23,"Manage natural air push never real.
Yourself fine add. Fire structure hand. Market that yourself himself instead feeling lot. Return project eat price Mrs scene region.",movie,Levi Harris,Beat floor forget field professor develop week world. Rate often general information wait agree need.,herself,1.60,22x24x8,2.10,attack,Pink,check,2560x1440,thought,can,50 GB,229 GB,60 MP,12 MP,myself,5.0,Like foreign time space stand outside together. Actually family let PM appear themselves economy station. Card single in military somebody piece.,"Best population choose into however morning bank. A property go.
Mr weight eight son world that another total. Certainly group age study thing quality oil.",<memory at 0x0000016026876680>,2017-10-19,2.0,In produzione,36,30,480.03,EUR
23,Democrat022,SN022,2015-10-05,century,Hampton PLC,2018-07-30,Riley-Brown,stock,2020-08-01,2021-06-19,"Tree already number price maybe discussion friend. Participant toward stand nearly stage.
Free across bed red. Popular travel candidate include visit stock somebody. Term after prevent nation.",say,Christina Byrd,Certain capital south question long. Across central society do add by. Ago present market during accept scene middle shake.,trip,4.11,28x22x6,5.28,challenge,WhiteSmoke,so,2560x1440,himself,teacher,45 GB,397 GB,63 MP,22 MP,security,5.0,"Floor stage husband manage. Enough PM act image.
Boy case current trade certain state. Bad well raise carry sit now detail look. Spend fly discuss if letter. Food partner forget message.","Language parent group lay entire factor safe pull. Foreign fear more president our against.
Down result pay position doctor star today.",<memory at 0x0000016026876B00>,2019-09-28,2.0,In produzione,15,6,612.34,USD
11,someone010,SN010,2015-09-01,nothing,Cabrera Ltd,2021-04-06,Hill LLC,reflect,2022-01-15,2022-04-23,Determine article hot six you response describe. Season kid put threat herself tell action.,range,Michelle Banks,"Mind much light might attorney. Firm accept education film population board space.
Like choose parent so appear. Choice meeting cut weight. Suddenly two serve enjoy own three herself plan.",agency,4.52,10x30x9,2.84,subject,OldLace,full,2560x1440,tonight,sister,59 GB,22 GB,23 MP,27 MP,I,4.2,"Live available as. Affect month he interest.
World against player focus weight. Remain fast little not.
Blue expert speak sign eat be situation. Nature network customer program rather record few.","Study air rather. Hundred music instead read million late.
Entire happen despite describe house film.
Direction fire end. Note wind from close before structure. Wear and may oil.",<memory at 0x0000016026875B40>,2016-05-25,1.0,Fuori produzione,12,8,984.74,EUR
